{
  "$schema": "https://json-schema.org/draft/2020-12/schema",
  "$id": "urn:mosaic:protocol:schema:v0.4:compatibility-manifest",
  "title": "Mosaic Protocol 0.4 Compatibility Manifest",
  "type": "object",
  "additionalProperties": false,
  "required": [
    "schemaVersion",
    "status",
    "schema",
    "canonicalFixture",
    "capabilities",
    "readerPolicy",
    "normalizedOutcomes"
  ],
  "properties": {
    "schemaVersion": {
      "type": "string",
      "const": "0.4"
    },
    "status": {
      "type": "string",
      "enum": [
        "draft",
        "releaseCandidate",
        "approved",
        "deprecated",
        "retired"
      ]
    },
    "deprecation": {
      "type": "object",
      "description": "Lifecycle metadata present only once this contract version enters the deprecated or retired state. Absent for draft, releaseCandidate, and approved contracts. See docs/protocol/deprecation-policy.md.",
      "additionalProperties": false,
      "required": [
        "deprecatedAt",
        "retiresAt"
      ],
      "properties": {
        "deprecatedAt": {
          "type": "string",
          "pattern": "^[0-9]{4}-(0[1-9]|1[0-2])-([0-2][0-9]|3[01])$",
          "description": "UTC calendar date on which this contract version was deprecated."
        },
        "retiresAt": {
          "type": "string",
          "pattern": "^[0-9]{4}-(0[1-9]|1[0-2])-([0-2][0-9]|3[01])$",
          "description": "Earliest UTC calendar date on which this contract version may be retired."
        },
        "supersededBy": {
          "type": "string",
          "minLength": 1,
          "maxLength": 128,
          "description": "Identifier of the approved successor contract version, when one exists."
        },
        "migrationGuide": {
          "type": "string",
          "minLength": 1,
          "maxLength": 256,
          "description": "Repository-relative path to the migration guide for the successor version."
        }
      }
    },
    "schema": {
      "type": "string",
      "const": "../schema/v0.4/paywall.schema.json"
    },
    "canonicalFixture": {
      "type": "string",
      "const": "../fixtures/v0.4/complete-paywall.json"
    },
    "capabilities": {
      "type": "array",
      "minItems": 1,
      "uniqueItems": true,
      "items": {
        "$ref": "#/$defs/capability"
      }
    },
    "readerPolicy": {
      "$ref": "#/$defs/readerPolicy"
    },
    "normalizedOutcomes": {
      "$ref": "#/$defs/normalizedOutcomes"
    }
  },
  "$defs": {
    "capabilityName": {
      "type": "string",
      "enum": [
        "layout.scrollContainer",
        "layout.stack",
        "layout.sizing",
        "layout.heightSizing",
        "layout.outerInsets",
        "navigation.screens",
        "navigation.sheets",
        "component.text",
        "component.image",
        "component.icon",
        "component.featureList",
        "component.productSelector",
        "component.productCard",
        "component.productBadge",
        "component.button",
        "component.carousel",
        "component.switch",
        "component.countdown",
        "component.tabs",
        "component.timeline",
        "component.award",
        "component.socialProof",
        "localization.catalogs",
        "localization.rtl",
        "localization.productTemplate",
        "product.references",
        "asset.bundledImage",
        "asset.remoteImage",
        "asset.bundledVideo",
        "asset.remoteVideo",
        "action.purchase",
        "action.restore",
        "action.close",
        "action.navigateTo",
        "action.navigateBack",
        "action.openExternalUrl",
        "accessibility.metadata",
        "accessibility.reservedStrings",
        "fallback.asset",
        "fallback.product",
        "outcome.normalized",
        "style.colors",
        "style.designTokens",
        "style.gradientBackground",
        "style.mediaBackground",
        "style.shadow",
        "style.box",
        "style.clipping",
        "style.typography",
        "visibility.static",
        "condition.switchVisibility",
        "condition.tabVisibility",
        "motion.appear",
        "motion.selection",
        "motion.loop"
      ]
    },
    "capability": {
      "type": "object",
      "additionalProperties": false,
      "required": [
        "name",
        "version",
        "fallback"
      ],
      "properties": {
        "name": {
          "$ref": "#/$defs/capabilityName"
        },
        "version": {
          "type": "string",
          "const": "0.4"
        },
        "fallback": {
          "description": "What a reader that does not support this capability does with a document requiring it. rejectDocument is the rule; renderWithoutMotion is the single deliberate exception, named for motion rather than generically so that graceful degradation cannot spread by imitation. A validator asserts that every non-motion capability remains rejectDocument.",
          "type": "string",
          "enum": [
            "rejectDocument",
            "renderWithoutMotion"
          ]
        }
      }
    },
    "readerPolicy": {
      "type": "object",
      "additionalProperties": false,
      "required": [
        "unknownSchemaVersion",
        "unknownComponent",
        "unknownProperty",
        "unsupportedRequiredCapability",
        "unsupportedEnhancementCapability",
        "invalidReference",
        "primaryDocumentRejected",
        "bundledFallbackRejected",
        "missingAsset",
        "missingMediaBackground",
        "fillInUnboundedAxis",
        "unavailableProduct",
        "missingProductPrice",
        "noAvailableProductCards",
        "invalidProductTemplate",
        "falseVisibilityCondition",
        "completedCountdown",
        "navigateBackWithoutHistory",
        "externalUrlOpenFailure",
        "reducedMotionAppear",
        "reducedMotionSelection",
        "reducedMotionLoop",
        "reducedMotionVideoBackground"
      ],
      "properties": {
        "unknownSchemaVersion": {
          "const": "rejectDocument"
        },
        "unknownComponent": {
          "const": "rejectDocument"
        },
        "unknownProperty": {
          "const": "rejectDocument"
        },
        "unsupportedRequiredCapability": {
          "const": "rejectDocument"
        },
        "unsupportedEnhancementCapability": {
          "const": "renderStaticDocument"
        },
        "invalidReference": {
          "const": "rejectDocument"
        },
        "primaryDocumentRejected": {
          "const": "loadBundledFallback"
        },
        "bundledFallbackRejected": {
          "const": "configurationUnavailable"
        },
        "missingAsset": {
          "const": "useDeclaredAssetFallback"
        },
        "missingMediaBackground": {
          "const": "usePosterThenFallbackColorAndDiagnose"
        },
        "fillInUnboundedAxis": {
          "const": "useFitAndDiagnose"
        },
        "unavailableProduct": {
          "const": "useSelectorFallback"
        },
        "missingProductPrice": {
          "const": "markCardUnavailable"
        },
        "noAvailableProductCards": {
          "const": "showSelectorFallbackAndDisablePurchase"
        },
        "invalidProductTemplate": {
          "const": "rejectDocument"
        },
        "falseVisibilityCondition": {
          "const": "removeFromLayoutAccessibilityAndFocus"
        },
        "completedCountdown": {
          "const": "showLocalizedCompletedText"
        },
        "navigateBackWithoutHistory": {
          "const": "noOpAndDiagnose"
        },
        "externalUrlOpenFailure": {
          "const": "remainAndDiagnose"
        },
        "reducedMotionAppear": {
          "const": "applyOpacityOnly"
        },
        "reducedMotionSelection": {
          "const": "applyInstantly"
        },
        "reducedMotionLoop": {
          "const": "renderRestState"
        },
        "reducedMotionVideoBackground": {
          "const": "renderPosterThenFallbackColorWithoutPlayback"
        }
      }
    },
    "normalizedOutcomes": {
      "type": "object",
      "additionalProperties": false,
      "required": [
        "selectProduct",
        "purchase",
        "restore",
        "close",
        "presentation"
      ],
      "properties": {
        "selectProduct": {
          "const": [
            "productSelected"
          ]
        },
        "purchase": {
          "const": [
            "purchased",
            "alreadyEntitled",
            "cancelled",
            "productUnavailable",
            "purchaseFailed"
          ]
        },
        "restore": {
          "const": [
            "restored",
            "alreadyEntitled",
            "restoreNoPurchases",
            "restoreFailed"
          ]
        },
        "close": {
          "const": [
            "dismissed"
          ]
        },
        "presentation": {
          "const": [
            "purchased",
            "restored",
            "alreadyEntitled",
            "dismissed",
            "cancelled",
            "productUnavailable",
            "configurationUnavailable",
            "purchaseFailed",
            "renderingFailed"
          ]
        }
      }
    }
  }
}
